<?xml version="1.0" encoding="UTF-8"?>
<clients xmlns:xs="http://www.w3.org/2001/XMLSchema-instance"
         xs:noNamespaceSchemaLocation="client.xsd">
    <client>
        <id>19</id>
        <name>Julia</name>
        <surname>Kozlova</surname>
        <login>Kozlova</login>
        <password>Kozlova</password>
        <discount>100000</discount>
    </client>
</clients>